{
  "case_id": "GD-14",
  "scenario": "The consent's own TTL expired before the guest resumed (a stalled session, or the guest returning after the active-execution window) -- the guard refuses cleanly, no write tool call is made.",
  "gd_ref": "GD-14",
  "input": {
    "fixture_id": "golden_safety_baseline",
    "scenario_kind": "consent_expired"
  },
  "expected_outcome": {
    "status": "aborted",
    "error_contains": "consent has expired",
    "write_calls": 0
  },
  "mode": "fake_backend",
  "source_id": "synthetic-2026-09-09",
  "pii_status": "none",
  "forbidden_tools": [
    "silpo_add_or_update_cart_products",
    "silpo_remove_cart_products"
  ],
  "rubric": "The write guard checks the consent's expiry before authorizing and refuses an expired one; the fake write tool is never called."
}
