{
  "case_id": "GD-02",
  "scenario": "The fix takes two items across two consent rounds, because the cart applies ~10% less than the catalogue quoted (D68, measured live at G8-5). Round 1 lands 449.10 against an expected 499.00 and leaves a 49.90 residual; round 2 closes it. Both writes are verified receipts carrying the price-difference note -- neither is downgraded to unverified for a discrepancy the tolerance was built to absorb.",
  "gd_ref": "GD-02",
  "input": {
    "fixture_id": "replay_gap_needs_two_items"
  },
  "expected_outcome": {
    "status": "verified",
    "primary_code": "order.cost.min",
    "receipts_count": 2,
    "receipt_statuses": ["receipt", "receipt"]
  },
  "mode": "replay",
  "source_id": "synthesized-offline-2026-09-09",
  "pii_status": "synthetic",
  "allowed_trajectories": [
    [
      "read",
      "diagnose",
      "compare_channels",
      "plan",
      "collect_and_gate",
      "rank",
      "explain",
      "write_guard",
      "write_and_readback",
      "persist_receipt",
      "diagnose",
      "write_guard",
      "write_and_readback",
      "persist_receipt"
    ]
  ],
  "allowed_tools": ["silpo_add_or_update_cart_products"],
  "forbidden_tools": ["silpo_remove_cart_products"],
  "rubric": "A verified write that leaves the blocker standing opens exactly one further round (D42), never silently reports success. The second round consents against the cart the FIRST write left, not the original snapshot, and the two writes accumulate rather than replacing one another."
}
