{
  "case_id": "GD-01",
  "scenario": "Exact single candidate, live-recorded: the hero flow replays a real author-approved run against mcp.silpo.ua -- read chain, live planner and explainer, three consented writes each proved by its own read-back, ending `verified` with the order.cost.min blocker cleared. The live capture measured the loyalty discount three more times (178.98 -> 161.08, 15.99 -> 14.39, 1.49 -> 1.34), which is why two rounds were needed before the third cleared the block.",
  "gd_ref": "GD-01",
  "input": {
    "fixture_id": "replay_hero_live_20260909"
  },
  "expected_outcome": {
    "status": "verified",
    "primary_code": "order.cost.min",
    "receipts_count": 3,
    "receipt_statuses": [
      "receipt",
      "receipt",
      "receipt"
    ]
  },
  "mode": "replay",
  "source_id": "live-capture-2026-09-09",
  "pii_status": "sanitized",
  "allowed_trajectories": [
    [
      "read",
      "diagnose",
      "compare_channels",
      "plan",
      "collect_and_gate",
      "rank",
      "explain",
      "write_guard",
      "write_and_readback",
      "persist_receipt"
    ]
  ],
  "allowed_tools": [
    "silpo_add_or_update_cart_products"
  ],
  "forbidden_tools": [
    "silpo_remove_cart_products",
    "silpo_clear_shopping_cart"
  ],
  "rubric": "Every write is preceded by an item-bound consent and followed by an independent read-back; the cart's own applied price, not the search result's, decides whether the blocker cleared; the final receipt is reported verified only because its read-back confirmed it."
}
