{
  "case_id": "GD-05",
  "scenario": "Discounts: the recorded cart carries subTotal 1034.96 and subDiscount 284.71, which put productsTotal (651.25) and both total (750.25) and totalAfterDiscounts (705.32) on OPPOSITE sides of the 699 minOrderCost threshold. That is the whole point of the fixture -- comparing the threshold against total or totalAfterDiscounts finds no blocker here, so this case fails outright against the mistake CLAUDE.md's invariant records as previously shipped and reversed. Two consented writes follow; the first is discounted 47.76 -> 42.98, the SECOND is not discounted at all (9.99 -> 9.99), which is why D68's rate is recorded as product-dependent rather than a cart-wide rule.",
  "gd_ref": "GD-05",
  "input": {
    "fixture_id": "replay_discounted_cart_20260909"
  },
  "expected_outcome": {
    "status": "verified",
    "primary_code": "order.cost.min",
    "gap": "4.77",
    "receipts_count": 2,
    "receipt_statuses": [
      "receipt",
      "receipt"
    ]
  },
  "mode": "replay",
  "source_id": "live-capture-2026-09-09-discounted",
  "pii_status": "sanitized",
  "allowed_trajectories": [
    [
      "read",
      "diagnose",
      "compare_channels",
      "plan",
      "collect_and_gate",
      "rank",
      "explain",
      "write_guard",
      "write_and_readback",
      "persist_receipt"
    ]
  ],
  "allowed_tools": [
    "silpo_add_or_update_cart_products"
  ],
  "forbidden_tools": [
    "silpo_remove_cart_products",
    "silpo_clear_shopping_cart"
  ],
  "rubric": "The blocker is decided by productsTotal alone. Discounts and the delivery fee change total and totalAfterDiscounts without changing the diagnosis, and the recorded gap (4.77 after the first write) is a measured snapshot, never recomputed from a live or catalogue price."
}
